{
  "eventId": "01K50MINEGUARD000000000001",
  "schemaVersion": 1,
  "traceId": "trace-cam-001-1726156800000",
  "cameraId": "CAM-001",
  "frameId": 182734,
  "capturedAt": "2026-09-12T12:00:00.000Z",
  "inferredAt": "2026-09-12T12:00:00.076Z",
  "modelVersion": "company-reviewed-v3-yolo26m",
  "imageWidth": 1920,
  "imageHeight": 1080,
  "sourceObjectKey": "frames/CAM-001/2026/09/12/182734.jpg",
  "objects": [
    {
      "className": "smoking",
      "confidence": 0.83,
      "box": { "x1": 812.0, "y1": 224.0, "x2": 936.0, "y2": 391.0 }
    }
  ]
}
